experiment_id,date,experiment_type,status,protocol_path,environment,robot_platform,simulator,scenario,token_targets,baseline,metrics,config_path,data_path,result_path,random_seed,script_or_snapshot,privacy_review,reproducibility_status,notes
EXP-V1-DN-001,2026-07-01,simulation_and_case_study,planned,04_experiments/protocols/exp_v1_doorway_narrow.md,ROS/Gazebo plus limited real robot,current ROS 1 Noetic building robot,ROS/Gazebo,"wide, borderline, and narrow passage scenarios",doorway_narrow; high_clearance,"move_base+TEB+costmap; simple distance heuristic","precision; recall; F1; detection latency; stuck/collision count",TBD,TBD,TBD,TBD,00a4fb1,not_required_no_human_subjects,planned,"V1 geometry-first doorway/passage narrowness protocol"
EXP-V1-TO-001,2026-07-01,simulation_and_case_study,planned,04_experiments/protocols/exp_v1_temporary_obstacle.md,ROS/Gazebo plus limited real robot,current ROS 1 Noetic building robot,ROS/Gazebo,"temporary object near/on planned route",temporary_obstacle; execution_blocked,"move_base+TEB+costmap; costmap obstacle layer; scan-only detector","precision; recall; F1; detection latency; detour/replan correctness; failure-reason accuracy",TBD,TBD,TBD,TBD,00a4fb1,privacy_safe_non_human_obstacles_only,planned,"V1 map-vs-current-observation temporary obstacle protocol"
VAL-ROS-V1-001,2026-07-14,integration_validation,completed,04_experiments/paet_ros_robot_validation.md,real robot building environment,current ROS 1 Noetic building robot,not_applicable,"package build; node launch; topic publication; one live event sample",doorway_narrow,not_applicable,"build success; node startup; output topic types; event and marker observation",ros/paet_ros/config/paet_v1.yaml,not_recorded,04_experiments/paet_ros_robot_validation.md,not_applicable,6477bf9,privacy_safe_metadata_only,partially_reproducible,"Integration evidence only; no labeled trials or accuracy claim. Observed sample clearance margin was -0.004 m."
<<<<<<< HEAD
EXP-V1-DN-CAL-001,2026-07-14,static_geometry_calibration,planned,04_experiments/protocols/exp_v1_doorway_static_calibration.md,real robot stationary building environment,current ROS 1 Noetic building robot,not_applicable,"stationary narrow/borderline/wide passage; open-area negative; clutter negative",doorway_narrow,not_applicable,"width error; event segment stability; false positive count",ros/paet_ros/config/paet_v1.yaml,external_paet_logs_and_trial_manifest,TBD,not_applicable,HEAD,privacy_safe_metadata_only,planned,"Stationary calibration only; robot does not move; no task success metric."
=======
VAL-LOGGER-V1-001,2026-07-14,logger_semantics_validation,completed,04_experiments/paet_logger_segment_validation.md,synthetic ROS events on real robot ROS workspace,current ROS 1 Noetic building robot,not_applicable,"continuous updates; sub-threshold gap; over-threshold gap; shutdown with active segment; launch run_id override",not_applicable,not_applicable,"merged segment row count; shutdown tail persistence; run_id isolation; catkin build",ros/paet_ros/config/paet_v1.yaml,temporary_directories_removed_after_each_case,04_experiments/paet_logger_segment_validation.md,not_applicable,7dee88b,privacy_safe_synthetic_events,reproducible_synthetic_ros_test,"All five logger acceptance checks passed; validates logging semantics only and makes no token-accuracy claim."
>>>>>>> f3a0c0422f36a524f618408c9f89f4ffad5c546b
